[
  {
    "name": "The_Hague",
    "file_type": "SHP",
    "metadata": {
      "data_owner": "Gemeente 's-Gravenhage (Gemeente)",
      "email_address": "none",
      "language": "Dutch",
      "primary_source": "https://data.overheid.nl/dataset/313fa20b-7608-447d-8882-3ae2b989bc5d",
      "download_link": "https://ckan.dataplatform.nl/dataset/2487aed5-961b-4add-ab88-2400fa6901f6/resource/038fc5b4-c086-4de1-99a1-9284685e0e6d/download/bomen-shape.zip"
    },
    "column_mapping": {
      "Latin_name": "SRT_WETENS",
      "Trunk_diameter": "STAMDIAMET"
    }
  },
  {
    "name": "Hilversum",
    "file_type": "JSON",
    "metadata": {
      "data_owner": "Hilversum (Gemeente)",
      "email_address": "none",
      "language": "Dutch",
      "primary_source": "https://open-hilversum.hub.arcgis.com/datasets/Hilversum::bomen/about",
      "download_link": "https://services-eu1.arcgis.com/YcscSJ1XstO6iVhP/arcgis/rest/services/Bomen_8b628/FeatureServer/0/query?outFields=*&where=1%3D1&f=geojson"
    },
    "column_mapping": {
      "Latin_name": "SOORTNAAM",
      "Height": "BOOMHOOGTEKLASSEACTUEEL",
      "Year_of_planting": "JAARVANAANLEG",
      "Trunk_diameter": "STAMDIAMETERKLASSE"
    }
  },
  {
    "name": "Utrecht",
    "file_type": "JSON",
    "metadata": {
      "data_owner": "Utrecht (Gemeente)",
      "email_address": "none",
      "language": "Dutch",
      "primary_source": "https://data.overheid.nl/dataset/utrecht-bomenkaart-update-2024#panel-resources",
      "download_link": "https://arcgis.com/sharing/rest/content/items/7e2404cf7fba4bb087935f9cdb51f053/data"
    },
    "column_mapping": {
      "Latin_name": "Wetenschappelijke_naam",
      "Year_of_planting": "Plantjaar"
    }
  },
  {
    "name": "Delft",
    "file_type": "JSON",
    "metadata": {
      "data_owner": "Delft (Gemeente)",
      "email_address": "none",
      "language": "Dutch",
      "primary_source": "https://data.delft.nl/datasets/bomen-in-beheer-door-gemeente-delft-1/about",
      "download_link": "https://hub.arcgis.com/api/v3/datasets/d83a50486b384bfe8038c2d762f5e628_0/downloads/data?format=geojson&spatialRefId=4326&where=1=1"
    },
    "column_mapping": {
      "Latin_name": "BOOMSORTIMENT",
      "Height": "HOOGTE",
      "Year_of_planting": "AANLEGJAAR",
      "Trunk_diameter": "DIAMETER"
    }
  },
  {
    "name": "Amsterdam",
    "file_type": "JSON",
    "metadata": {
      "data_owner": "Amsterdam (Gemeente)",
      "email_address": "data-helpdesk@amsterdam.nl",
      "language": "Dutch",
      "primary_source": "https://api.data.amsterdam.nl/v1/bomen/v1/stamgegevens",
      "download_link": "https://api.data.amsterdam.nl/v1/bomen/v1/stamgegevens?_format=geojson"
    },
    "column_mapping": {
      "Latin_name": "soortnaam",
      "Height": "boomhoogteklasseActueel",
      "Year_of_planting": "jaarVanAanleg",
      "Trunk_diameter": "none"
    }
  },
  {
    "name": "Groningen",
    "file_type": "JSON",
    "metadata": {
      "data_owner": "Groningen (Gemeente)",
      "email_address": "opendata@groningen.nl",
      "language": "Dutch",
      "primary_source": "https://data.groningen.nl/dataset/bomen-gemeente-groningen",
      "download_link": "https://maps.groningen.nl/geoserver/geo-data/ows?service=WFS&version=1.0.0&request=GetFeature&typeName=geo-data:Bomen%20gemeente%20Groningen&maxFeatures=1000000&outputFormat=application/json&srsName=EPSG:4326&format_options=id_policy:reference_no=false"
    },
    "column_mapping": {
      "Latin_name": "LATIJNSE_NAAM",
      "Height": "BOOMHOOGTE",
      "Year_of_planting": "KIEMJAAR",
      "Trunk_diameter": "none"
    }
  },
  {
    "name": "Dronten",
    "file_type": "CSV",
    "lat_column": "LAT",
    "lon_column": "LON",
    "CRS": "ESPG:4326",
    "metadata": {
      "data_owner": "Dronten (Gemeente)",
      "email_address": "data@dronten.nl",
      "language": "Dutch",
      "primary_source": "http://data.overheid.nl/dataset/bomenkaart-dronten",
      "download_link": "https://nedgeoservices.nedgraphicscs.nl/geoserver/ows?service=WFS&version=1.1.0&request=GetFeature&typeName=topp:O10002_Bomenkaart_OD&outputFormat=csv"
    },
    "column_mapping": {
      "Latin_name": "latijnse_naam",
      "Height": "hoogte",
      "Year_of_planting": "plantjaar",
      "Trunk_diameter": "none"
    }
  },
  {
    "name": "Eindhoven",
    "file_type": "PARQUET",
    "metadata": {
      "data_owner": "Eindhoven (Gemeente)",
      "email_address": "data@eindhoven.nl",
      "language": "Dutch",
      "primary_source": "https://data.eindhoven.nl/explore/dataset/bomen/information/?disjunctive.beheerder&disjunctive.boomsoort&disjunctive.hoogte&disjunctive.eigenaar&disjunctive.eindbeeld&disjunctive.boomsoort_nederlands&disjunctive.status_ter_indicatie",
      "download_link": "https://data.eindhoven.nl/api/explore/v2.1//catalog/datasets/bomen/exports/parquet"
    },
    "column_mapping": {
      "Latin_name": "boomsoort",
      "Height": "hoogte",
      "Year_of_planting": "plantjaar",
      "Trunk_diameter": "none"
    }
  },
  {
    "name": "Nijmegen",
    "file_type": "CSV",
    "geometry_column": "GEOMETRIE",
    "crs": "EPSG:28992",
    "metadata": {
      "data_owner": "Eindhoven (Gemeente)",
      "email_address": "opendata@nijmegen.nl",
      "language": "Dutch",
      "primary_source": "https://opendata.nijmegen.nl/dataset/bomen",
      "download_link": "https://services.nijmegen.nl/geoservices/extern_BOR_Groen/ows?service=WFS&version=1.0.0&request=GetFeature&typeName=extern_BOR_Groen%3AGRN_BOMEN&outputFormat=csv"
    },
    "column_mapping": {
      "Latin_name": "BOOMSOORT",
      "Height": "HOOGTE_EXACT",
      "Year_of_planting": "PLANTJAAR",
      "Trunk_diameter": "STAMDIAMETER"
    }
  }
]